{
  "experiment_id": "nft-BAYC-real",
  "contract": {
    "chain": "ethereum",
    "address": "0x1234...abcd",
    "label": "ExampleGovernor"
  },
  "etherscan": {
    "functions": [
      {
        "name": "propose",
        "kind": "function",
        "gas_estimate": 210000,
        "provenance": {
          "source_type": "etherscan",
          "source_ref": "etherscan://contract/0x1234...abcd#function:propose"
        }
      },
      {
        "name": "castVote",
        "kind": "function",
        "gas_estimate": 95000,
        "provenance": {
          "source_type": "etherscan",
          "source_ref": "etherscan://contract/0x1234...abcd#function:castVote"
        }
      }
    ],
    "events": [
      {
        "name": "ProposalCreated",
        "kind": "event",
        "provenance": {
          "source_type": "etherscan",
          "source_ref": "etherscan://contract/0x1234...abcd#event:ProposalCreated"
        }
      },
      {
        "name": "VoteCast",
        "kind": "event",
        "provenance": {
          "source_type": "etherscan",
          "source_ref": "etherscan://contract/0x1234...abcd#event:VoteCast"
        }
      }
    ]
  },
  "dune": {
    "metrics": [
      {
        "name": "daily_proposals",
        "granularity": "day",
        "trend_hint": "stable_low",
        "notes": "Proposal creation remains infrequent and steady over the observed window.",
        "provenance": {
          "source_type": "dune",
          "source_ref": "dune://query/example-governance-daily-proposals"
        }
      },
      {
        "name": "daily_votes",
        "granularity": "day",
        "trend_hint": "bursty_around_proposals",
        "notes": "Voting activity clusters around proposal publication windows.",
        "provenance": {
          "source_type": "dune",
          "source_ref": "dune://query/example-governance-daily-votes"
        }
      }
    ]
  }
}
