{
  "experiment_id": "nft-BAYC-real",
  "contract": {
    "chain": "ethereum",
    "address": "0x1234...abcd",
    "label": "ExampleGovernor"
  },
  "etherscan": {
    "functions": [
      {
        "function_name": "propose",
        "gas_estimate": 210000,
        "source_ref": "etherscan://contract/0x1234...abcd#function:propose"
      },
      {
        "function_name": "castVote",
        "gas_estimate": 95000,
        "source_ref": "etherscan://contract/0x1234...abcd#function:castVote"
      }
    ],
    "events": [
      {
        "event_name": "ProposalCreated",
        "source_ref": "etherscan://contract/0x1234...abcd#event:ProposalCreated"
      },
      {
        "event_name": "VoteCast",
        "source_ref": "etherscan://contract/0x1234...abcd#event:VoteCast"
      }
    ]
  },
  "dune": {
    "metrics": [
      {
        "metric_name": "daily_proposals",
        "granularity": "day",
        "trend_hint": "stable_low",
        "notes": "Proposal creation remains infrequent and steady over the observed window.",
        "source_ref": "dune://query/example-governance-daily-proposals"
      },
      {
        "metric_name": "daily_votes",
        "granularity": "day",
        "trend_hint": "bursty_around_proposals",
        "notes": "Voting activity clusters around proposal publication windows.",
        "source_ref": "dune://query/example-governance-daily-votes"
      }
    ]
  }
}
